<?xml version="1.0" encoding="iso-8859-1" ?>
<!--
  ~ Copyright (C) Johannes Fähndrich - All Rights Reserved.
  ~ Unauthorized copying of this file, via any medium is strictly
  ~ prohibited Proprietary and confidential.
  ~ Written by Johannes Fähndrich <faehndrich@gmail.com.com>,  2011
  ~
  -->

<!DOCTYPE head SYSTEM "heads.dtd">
<?xml-stylesheet href="rogets.xsl" type="text/xsl" ?>

<head number="893" name="Fop" origNum="#854." class="8" section="2" subSection="2" headGroup="6">
	<pos number="1" type="N.">
		<paragraph number="1" name="fop">
			<sg number="1">
				<word number="1">fop</word>
				<word number="2">fine gentleman</word>
			</sg>
			<sg number="2">
				<word number="1">swell</word>
			</sg>
			<sg number="3">
				<word number="1">dandy</word>
				<word number="2">dandiprat!</word>
			</sg>
			<sg number="4">
				<word number="1">exquisite</word>
				<word number="2">coxcomb</word>
				<word number="3">beau</word>
				<word number="4">macaroni</word>
				<word number="5">blade</word>
				<word number="6">blood</word>
				<word number="7">buck</word>
				<word number="8">man about town</word>
				<word number="9">fast man</word>
			</sg>
			<sg number="5">
				<word number="1">fribble</word>
				<word number="2">milliner!</word>
			</sg>
			<sg number="6">
				<word number="1">Jemmy Jessamy!</word>
				<word number="2">carpet knight</word>
			</sg>
			<sg number="7">
				<word number="1">masher</word>
				<word number="2">dude</word>
			</sg>
		</paragraph>
		<paragraph number="2" name="fine lady">
			<sg number="1">
				<word number="1">fine lady</word>
				<word number="2">coquette</word>
			</sg>
			<sg number="2">
				<word number="1">flirt</word>
				<word number="2">vamp</word>
			</sg>
		</paragraph>
	</pos>
</head>
