<?xml version="1.0" encoding="iso-8859-1" ?>
<!--
  ~ Copyright (C) Johannes Fähndrich - All Rights Reserved.
  ~ Unauthorized copying of this file, via any medium is strictly
  ~ prohibited Proprietary and confidential.
  ~ Written by Johannes Fähndrich <faehndrich@gmail.com.com>,  2011
  ~
  -->

<!DOCTYPE head SYSTEM "heads.dtd">
<?xml-stylesheet href="rogets.xsl" type="text/xsl" ?>

<head number="996" name="Intemperance" origNum="#954." class="8" section="4" subSection="4" headGroup="1">
	<pos number="1" type="N.">
		<paragraph number="1" name="intemperance">
			<sg number="1">
				<word number="1">intemperance</word>
			</sg>
			<sg number="2">
				<word number="1">sensuality</word>
				<word number="2">animalism</word>
				<word number="3">carnality</word>
			</sg>
			<sg number="3">
				<word number="1">tragalism</word>
			</sg>
			<sg number="4">
				<word number="1">pleasure</word>
			</sg>
			<sg number="5">
				<word number="1">effeminacy</word>
				<word number="2">silkiness</word>
			</sg>
			<sg number="6">
				<word number="1">luxury</word>
				<word number="2">luxuriousness</word>
			</sg>
			<sg number="7">
				<word number="1">lap of pleasure</word>
				<word number="2">lap of luxury</word>
			</sg>
			<sg number="8">
				<word number="1">free living</word>
			</sg>
		</paragraph>
		<paragraph number="2" name="indulgence">
			<sg number="1">
				<word number="1">indulgence</word>
			</sg>
			<sg number="2">
				<word number="1">high living</word>
				<word number="2">wild living</word>
				<word number="3">inabstinence</word>
				<word number="4">self- indulgence</word>
			</sg>
			<sg number="3">
				<word number="1" paraRef="" posRef="adj.">voluptuousness</word>
			</sg>
			<sg number="4">
				<word number="1">epicurism</word>
				<word number="2">epicureanism</word>
			</sg>
			<sg number="5">
				<word number="1">sybaritism</word>
			</sg>
			<sg number="6">
				<word number="1">drug habit</word>
			</sg>
		</paragraph>
		<paragraph number="3" name="dissipation">
			<sg number="1">
				<word number="1">dissipation</word>
			</sg>
			<sg number="2">
				<word number="1" paraRef="" posRef="adj.">licentiousness</word>
			</sg>
			<sg number="3">
				<word number="1">debauchery</word>
			</sg>
			<sg number="4">
				<word number="1">crapulence</word>
			</sg>
		</paragraph>
		<paragraph number="4" name="revels">
			<sg number="1">
				<word number="1">revels</word>
				<word number="2">revelry</word>
			</sg>
			<sg number="2">
				<word number="1">debauch</word>
				<word number="2">carousal</word>
				<word number="3">jollification</word>
				<word number="4">drinking bout</word>
				<word number="5">wassail</word>
				<word number="6">saturnalia</word>
				<word number="7">orgies</word>
			</sg>
			<sg number="3">
				<word number="1">excess</word>
				<word number="2">too much</word>
			</sg>
		</paragraph>
		<paragraph number="5" name="Circean cup">
			<sg number="1">
				<word number="1">Circean cup</word>
			</sg>
		</paragraph>
		<paragraph number="6" name="bhang">
			<sg number="1">
				<word number="1">bhang</word>
				<word number="2">hashish</word>
				<word number="3">marijuana</word>
				<word number="4">pot</word>
				<word number="5">hemp</word>
				<word number="6">grass</word>
			</sg>
			<sg number="2">
				<word number="1">opium</word>
				<word number="2">cocaine</word>
				<word number="3">morphine</word>
				<word number="4">heroin</word>
				<word number="5" new="1">subkingdom</word>
				<word number="6" new="1">allemande</word>
				<word number="7" new="1">chyme</word>
				<word number="8" new="1">zapovedniks</word>
				<word number="9" new="1">trachomatis</word>
			</sg>
			<sg number="3">
				<word number="1">LSD</word>
				<word number="2">lysergic acid diethylamide</word>
			</sg>
			<sg number="4">
				<word number="1">phencyclidine</word>
				<word number="2">angel dust</word>
				<word number="3">PCP</word>
			</sg>
			<sg number="5">
				<word number="1">barbiturates</word>
			</sg>
			<sg number="6">
				<word number="1">amphetamines</word>
				<word number="2">speed</word>
			</sg>
			<sg number="7">
				<word number="1" new="1">syndicated</word>
			</sg>
		</paragraph>
	</pos>
	<pos number="2" type="VB.">
		<paragraph number="1" name="be intemperate">
			<sg number="1">
				<word number="1" paraRef="" posRef="adj.">be intemperate</word>
			</sg>
			<sg number="2">
				<word number="1">indulge</word>
				<word number="2">exceed</word>
			</sg>
			<sg number="3">
				<word number="1">live well</word>
				<word number="2">live high</word>
				<word number="3">live high on the fat of the land</word>
				<word number="4">live it up</word>
				<word number="5">live high on the hog</word>
			</sg>
			<sg number="4">
				<word number="1" paraRef="" posRef="n.">give a loose to indulgence</word>
			</sg>
			<sg number="5">
				<word number="1" paraRef="" posRef="n.">wallow in voluptuousness</word>
			</sg>
			<sg number="6">
				<word number="1">plunge into dissipation</word>
			</sg>
		</paragraph>
		<paragraph number="2" name="revel">
			<sg number="1">
				<word number="1">revel</word>
			</sg>
			<sg number="2">
				<word number="1">rake</word>
				<word number="2">live hard</word>
				<word number="3">run riot</word>
				<word number="4">sow one's wild oats</word>
			</sg>
			<sg number="3">
				<word number="1">slake one's appetite</word>
				<word number="2">slake one's thirst</word>
			</sg>
			<sg number="4">
				<word number="1">swill</word>
			</sg>
			<sg number="5">
				<word number="1">pamper</word>
			</sg>
		</paragraph>
	</pos>
	<pos number="3" type="ADJ.">
		<paragraph number="1" name="intemperate">
			<sg number="1">
				<word number="1">intemperate,inabstinent</word>
			</sg>
			<sg number="2">
				<word number="1">sensual</word>
				<word number="2">self-indulgent</word>
			</sg>
			<sg number="3">
				<word number="1">voluptuous</word>
				<word number="2">luxurious</word>
				<word number="3">licentious</word>
				<word number="4">wild</word>
				<word number="5">dissolute</word>
				<word number="6">rakish</word>
				<word number="7">fast</word>
				<word number="8">debauched</word>
				<word number="9" new="1">extraverted</word>
			</sg>
		</paragraph>
		<paragraph number="2" name="brutish">
			<sg number="1">
				<word number="1">brutish</word>
				<word number="2">crapulous</word>
				<word number="3">swinish</word>
				<word number="4">piggish</word>
			</sg>
		</paragraph>
		<paragraph number="3" name="Paphian">
			<sg number="1">
				<word number="1">Paphian</word>
				<word number="2">Epicurean</word>
				<word number="3">Sybaritical</word>
			</sg>
			<sg number="2">
				<word number="1">bred in the lap of luxury</word>
				<word number="2">nursed in the lap of luxury</word>
			</sg>
			<sg number="3">
				<word number="1">indulged</word>
				<word number="2">pampered</word>
			</sg>
			<sg number="4">
				<word number="1">full-fed</word>
				<word number="2">high-fed</word>
			</sg>
		</paragraph>
	</pos>
	<pos number="6" type="PHR.">
		<paragraph number="1" name="being full of supper and distempering draughts">
			<sg number="1">
				<word number="1">"being full of supper and distempering draughts"</word>
			</sg>
		</paragraph>
	</pos>
</head>
