<?xml version="1.0" encoding="iso-8859-1" ?>
<!--
  ~ Copyright (C) Johannes Fähndrich - All Rights Reserved.
  ~ Unauthorized copying of this file, via any medium is strictly
  ~ prohibited Proprietary and confidential.
  ~ Written by Johannes Fähndrich <faehndrich@gmail.com.com>,  2011
  ~
  -->

<!DOCTYPE head SYSTEM "heads.dtd">
<?xml-stylesheet href="rogets.xsl" type="text/xsl" ?>

<head number="600" name="Vigor" origNum="#574." class="5" section="3" subSection="2" headGroup="10">
	<pos number="1" type="N.">
		<paragraph number="1" name="vigor">
			<sg number="1">
				<word number="1">vigor</word>
				<word number="2">power</word>
				<word number="3">force</word>
			</sg>
			<sg number="2">
				<word number="1">boldness</word>
				<word number="2" paraRef="" posRef="adj.">raciness</word>
			</sg>
			<sg number="3">
				<word number="1">intellectual</word>
				<word number="2">force</word>
			</sg>
			<sg number="4">
				<word number="1">spirit</word>
				<word number="2">point</word>
				<word number="3">antithesis</word>
				<word number="4">piquance</word>
				<word number="5">piquancy</word>
			</sg>
			<sg number="5">
				<word number="1">verve</word>
				<word number="2">glow</word>
				<word number="3">fire</word>
				<word number="4">warmth</word>
			</sg>
			<sg number="6">
				<word number="1">strong language</word>
			</sg>
			<sg number="7">
				<word number="1">gravity</word>
				<word number="2">sententiousness</word>
			</sg>
			<sg number="8">
				<word number="1">elevation</word>
				<word number="2">loftiness</word>
				<word number="3">sublimity</word>
			</sg>
		</paragraph>
		<paragraph number="2" name="eloquence">
			<sg number="1">
				<word number="1">eloquence</word>
			</sg>
			<sg number="2">
				<word number="1">command of words</word>
				<word number="2">command of language</word>
			</sg>
		</paragraph>
	</pos>
	<pos number="3" type="ADJ.">
		<paragraph number="1" name="vigorous">
			<sg number="1">
				<word number="1">vigorous</word>
				<word number="2">nervous</word>
				<word number="3">powerful</word>
				<word number="4">forcible</word>
				<word number="5">trenchant</word>
				<word number="6">incisive</word>
				<word number="7">impressive</word>
			</sg>
			<sg number="2">
				<word number="1">sensational</word>
			</sg>
		</paragraph>
		<paragraph number="2" name="spirited">
			<sg number="1">
				<word number="1">spirited</word>
				<word number="2">lively</word>
				<word number="3">glowing</word>
				<word number="4">sparkling</word>
				<word number="5">racy</word>
				<word number="6">bold</word>
				<word number="7">slashing</word>
			</sg>
			<sg number="2">
				<word number="1">pungent</word>
				<word number="2">piquant</word>
				<word number="3">full of point</word>
				<word number="4">pointed</word>
				<word number="5">pithy</word>
				<word number="6">antithetical</word>
			</sg>
			<sg number="3">
				<word number="1">sententious</word>
			</sg>
		</paragraph>
		<paragraph number="3" name="lofty">
			<sg number="1">
				<word number="1">lofty</word>
				<word number="2">elevated</word>
				<word number="3">sublime</word>
			</sg>
			<sg number="2">
				<word number="1">eloquent</word>
			</sg>
			<sg number="3">
				<word number="1">vehement</word>
				<word number="2">petulant</word>
				<word number="3">impassioned</word>
				<word number="4" new="1">vociferous</word>
			</sg>
			<sg number="4">
				<word number="1">poetic</word>
			</sg>
			<sg number="5">
				<word number="1" new="1">fiery</word>
			</sg>
		</paragraph>
	</pos>
	<pos number="4" type="ADV.">
		<paragraph number="1" name="in glowing terms">
			<sg number="1">
				<word number="1">in glowing terms</word>
				<word number="2">in good set terms</word>
				<word number="3">in no measured terms</word>
			</sg>
		</paragraph>
	</pos>
	<pos number="6" type="PHR.">
		<paragraph number="1" name="thoughts that breath and words that burn">
			<sg number="1">
				<word number="1">"thoughts that breath and words that burn"</word>
			</sg>
		</paragraph>
	</pos>
</head>
